{
  "checks": [
    {
      "check_id": "CHK_SCHEMA_PROVENANCE_ENVELOPE",
      "details": {
        "rc": 0
      },
      "errors": [],
      "verdict": "PASS"
    }
  ],
  "created_utc": "2026-03-04T00:32:39Z",
  "schema_version": "1",
  "trace_id": "ea11a1a0f75afa52ba4e26b3aebaffeda17aed848aedaad3190b68b4a67461bc",
  "verdict": "PASS"
}